{
  "$schema": "https://json-schema.org/draft/2020-12/schema",
  "$id": "https://openit.example/ops-feedback/failurecase-ext.schema.json",
  "title": "OpsFeedbackFailureCaseExt",
  "description": "FailureCase.ext[\"ops-feedback\"]의 내용. 계약의 FailureCase.ext는 영역 이름 키 아래 자유 객체다(내용 정의 없음). 만드는 쪽: ops-feedback(잡이 처음 쓰고 검토 게시가 review, reviewed_by를 덧붙인다). 읽는 쪽: 이웃은 보존만 하는 것이 원칙이고, 읽는 이웃이 생기면 이 스키마를 기준으로 한다. 모르는 키: 읽는 쪽은 무시(additionalProperties 허용), 이 영역이 쓰는 값은 아래 키뿐이다. 제안: 쓰는 쪽도 아래 키 밖을 쓰지 않는다는 불변식을 이 영역이 지킨다(시험으로 확인하지 않았다).",
  "type": "object",
  "required": ["detections", "primary_rule", "deid_policy_id", "deid_stats"],
  "additionalProperties": true,
  "properties": {
    "detections": {"type": "array", "minItems": 1, "items": {"type": "object", "required": ["rule_id", "detail"], "additionalProperties": false, "properties": {"rule_id": {"type": "string", "pattern": "^[A-Z][A-Z0-9_]*$"}, "detail": {"type": "object", "description": "개인정보가 없는 값만(규칙 ID, 열거값, 개수). 규칙별 키는 detect.py가 정한다."}}}},
    "primary_rule": {"type": "string", "pattern": "^[A-Z][A-Z0-9_]*$"},
    "deid_policy_id": {"type": "string", "minLength": 1},
    "deid_stats": {"type": "object", "description": "비식별 처리 건수. 값은 비음 정수, 경로 목록은 문자열 배열.", "properties": {"masked_paths": {"type": "array", "items": {"type": "string"}}, "dropped_paths": {"type": "array", "items": {"type": "string"}}}, "additionalProperties": {"type": ["integer", "array"]}},
    "pause_reason": {"enum": ["RISK", "REASK_LIMIT", "OTHER"], "description": "정지 사유(PUBLIC_API H절). 없으면 미상. 모르는 값은 읽는 쪽이 OTHER로 취급"},
    "review": {"type": "object", "required": ["reviewer_role"], "additionalProperties": false, "properties": {"reviewer_role": {"type": "string", "minLength": 1}, "note": {"type": "string"}}},
    "reviewed_by": {"type": "string", "pattern": "^[A-Za-z0-9][A-Za-z0-9._:-]{0,127}$", "description": "X-Openit-User 값 또는 토큰 역할 이름"}
  }
}
